{"package_id":"pkg_live_mvn8btci","spec_version":"1.0","q":0.9,"q_breakdown":{"evidence":0.6,"diversity":0.2,"recency":0.1},"evidence":[{"url":"https://example.com/a","source":"test"},{"url":"https://example.com/b","source":"test"},{"url":"https://example.com/c","source":"test"}],"evidence_count":3,"source_diversity":2,"verified_at":"2026-10-25T02:56:05.928Z","expires_at":"2026-10-25T03:56:05.927Z","verifier_version":"1.16","verifier_signature":"ed25519:rabbytest","data_hash":"sha256:rabbytest","schema_url":"https://onsite-aeo.jerry-aeo.workers.dev/.well-known/verification-schema.json","license":"CC-BY-4.0","hallucination_boundary":"rabby-e2e"}