{
  "package_id": "research-2026-q4-ai-agent-adoption",
  "spec_version": "1.0",
  "q": 0.81,
  "q_breakdown": {
    "source_coverage": 0.86,
    "freshness": 0.78,
    "internal_consistency": 0.84,
    "claim_specificity": 0.77
  },
  "evidence": [
    {
      "evidence_id": "ev-001",
      "source_url": "https://example.org/research/report-2026-09",
      "source_type": "primary_research",
      "accessed_at": "2026-10-01T08:12:00Z",
      "excerpt_hash": "sha256:3a7bd3e2360a3d29aefb2b5716b7f98c89a2f4b2e1c0d5a8b6f4e3d2c1b0a9f8",
      "span": "para 4-7",
      "verifier_score": 0.92
    },
    {
      "evidence_id": "ev-002",
      "source_url": "https://statista.com/topics/ai-agents",
      "source_type": "secondary_report",
      "accessed_at": "2026-10-02T10:30:00Z",
      "excerpt_hash": "sha256:9f21a0d5b4c6e7f8a9b0c1d2e3f4a5b6c7d8e9f0a1b2c3d4e5f6a7b8c9d0e1f2",
      "span": "section 3.2",
      "verifier_score": 0.87
    },
    {
      "evidence_id": "ev-003",
      "source_url": "https://arxiv.org/abs/2608.12345",
      "source_type": "primary_research",
      "accessed_at": "2026-10-05T14:00:00Z",
      "excerpt_hash": "sha256:5e1f2a3b4c5d6e7f8a9b0c1d2e3f4a5b6c7d8e9f0a1b2c3d4e5f6a7b8c9d0e1f",
      "span": "abstract + section 2",
      "verifier_score": 0.95
    },
    {
      "evidence_id": "ev-004",
      "source_url": "https://example-org.net/news/2026-10-10",
      "source_type": "news",
      "accessed_at": "2026-10-10T09:00:00Z",
      "excerpt_hash": "sha256:aabbccddeeff00112233445566778899aabbccddeeff00112233445566778899",
      "span": "para 1-3",
      "verifier_score": 0.74
    },
    {
      "evidence_id": "ev-005",
      "source_url": "https://analytics.io/dataset/ai-adoption-2026q3",
      "source_type": "dataset",
      "accessed_at": "2026-10-12T16:45:00Z",
      "excerpt_hash": "sha256:1111222233334444555566667777888899990000111122223333444455556666",
      "span": "table 2 rows 1-50",
      "verifier_score": 0.81
    },
    {
      "evidence_id": "ev-006",
      "source_url": "https://gartner.com/insights/agentic-ai-2026",
      "source_type": "analyst",
      "accessed_at": "2026-10-14T11:20:00Z",
      "excerpt_hash": "sha256:aaaa0000bbbb1111cccc2222dddd3333eeee4444ffff5555aaaa6666bbbb7777",
      "span": "executive summary",
      "verifier_score": 0.88
    }
  ],
  "evidence_count": 6,
  "source_diversity": 1,
  "verified_at": "2026-10-15T02:00:00Z",
  "expires_at": "2027-01-15T02:00:00Z",
  "verifier_version": "v2.3.1",
  "verifier_signature": "ed25519:4guVG8cGp1WB0E50OEv2qNn88u6Q8yU-nGiriyfsqJIJc88Y-p_3kRyaUgMrjyTFzUu7JEoGgv-H_0faiuprDw",
  "data_hash": "sha256:44f26b13b2a88079f6bdd20a3492d554244a4b839324a866cb4fa56839acbc96",
  "schema_url": "https://REPLACE_WITH_YOUR_DOMAIN/schemas/verification-v1.json",
  "license": "commercial-use-permitted",
  "hallucination_boundary": "Evidence excerpts are verifier-validated at verified_at. Downstream interpretation is caller responsibility."
}
